{
  "url": "https://www.example.com/research/demo-btc",
  "canonicalUrl": "https://www.example.com/research/demo-btc",
  "capturedAt": "2026-09-10T12:00:00Z",
  "sha256": "aaaaaaaaaaaaaaaaaaaaaaaaaaaaaaaaaaaaaaaaaaaaaaaaaaaaaaaaaaaaaaaa",
  "bytes": 128,
  "contentType": "text/html",
  "note": "EXAMPLE. Fictional freeze. Not a live print."
}
